[
  {
    "id": "SY-DI-DAM-77AUTO-001",
    "name_ar": "77Auto HQ",
    "name_en": "77Auto HQ",
    "operator": "Electro taxi",
    "governorate": "Damascus",
    "city": "Damascus",
    "address": "77Auto HQ",
    "latitude": 33.593122,
    "longitude": 36.408345,
    "connectors": [],
    "power_kw": 0,
    "guns": 5,
    "status": "unknown",
    "access": "",
    "price_note": "",
    "source_name": "Uploaded EV charger location dataset / Google Maps link",
    "source_url": "https://www.google.com/maps?q=33.593122,36.408345",
    "source_date": "",
    "last_verified": "",
    "data_quality": "Unverified",
    "notes": "Site type: Company / Office. Status, connector type, charging power, source date, and last verification date were not provided in the uploaded dataset."
  },
  {
    "id": "SY-DI-DAM-SHERATON-001",
    "name_ar": "Sheraton Hotel",
    "name_en": "Sheraton Hotel",
    "operator": "Electro taxi",
    "governorate": "Damascus",
    "city": "Damascus",
    "address": "Sheraton Hotel",
    "latitude": 33.513925,
    "longitude": 36.272821,
    "connectors": [],
    "power_kw": 0,
    "guns": 2,
    "status": "unknown",
    "access": "",
    "price_note": "",
    "source_name": "Uploaded EV charger location dataset / Google Maps link",
    "source_url": "https://www.google.com/maps?q=33.513925,36.272821",
    "source_date": "",
    "last_verified": "",
    "data_quality": "Unverified",
    "notes": "Site type: Hotel. Status, connector type, charging power, source date, and last verification date were not provided in the uploaded dataset."
  },
  {
    "id": "SY-DI-DAM-DAMASCINO-001",
    "name_ar": "Damascino Mall",
    "name_en": "Damascino Mall",
    "operator": "Electro taxi",
    "governorate": "Damascus",
    "city": "Damascus",
    "address": "Damascino Mall",
    "latitude": 33.500302,
    "longitude": 36.275342,
    "connectors": [],
    "power_kw": 0,
    "guns": 1,
    "status": "unknown",
    "access": "",
    "price_note": "",
    "source_name": "Uploaded EV charger location dataset / Google Maps link",
    "source_url": "https://www.google.com/maps?q=33.500302,36.275342",
    "source_date": "",
    "last_verified": "",
    "data_quality": "Unverified",
    "notes": "Site type: Mall / Commercial. Status, connector type, charging power, source date, and last verification date were not provided in the uploaded dataset."
  },
  {
    "id": "SY-RD-DAM-JALLAB-001",
    "name_ar": "Al Jallab Rest Area",
    "name_en": "Al Jallab Rest Area",
    "operator": "Electro taxi",
    "governorate": "Rural Damascus",
    "city": "Rural Damascus",
    "address": "Al Jallab Rest Area",
    "latitude": 34.72361,
    "longitude": 36.69641,
    "connectors": [],
    "power_kw": 0,
    "guns": 1,
    "status": "unknown",
    "access": "",
    "price_note": "",
    "source_name": "Uploaded EV charger location dataset / Google Maps link",
    "source_url": "https://maps.app.goo.gl/e7fqUaYDCnTQ8jAy5",
    "source_date": "",
    "last_verified": "",
    "data_quality": "Unverified",
    "notes": "Site type: Service Station / Hub. Potential near-duplicate coordinates in uploaded dataset; verify location. Status, connector type, charging power, source date, and last verification date were not provided in the uploaded dataset."
  },
  {
    "id": "SY-HO-HOM-CLOVER-001",
    "name_ar": "Clover Mall",
    "name_en": "Clover Mall",
    "operator": "Electro taxi",
    "governorate": "Homs",
    "city": "Homs",
    "address": "Clover Mall",
    "latitude": 34.723609,
    "longitude": 36.69641,
    "connectors": [],
    "power_kw": 0,
    "guns": 1,
    "status": "unknown",
    "access": "",
    "price_note": "",
    "source_name": "Uploaded EV charger location dataset / Google Maps link",
    "source_url": "https://www.google.com/maps?q=34.723609,36.696410",
    "source_date": "",
    "last_verified": "",
    "data_quality": "Unverified",
    "notes": "Site type: Mall / Commercial. Potential near-duplicate coordinates in uploaded dataset; verify location. Status, connector type, charging power, source date, and last verification date were not provided in the uploaded dataset."
  },
  {
    "id": "SY-HA-HAM-FAMILY-001",
    "name_ar": "Family Center",
    "name_en": "Family Center",
    "operator": "Electro taxi",
    "governorate": "Hama",
    "city": "Hama",
    "address": "Family Center",
    "latitude": 35.059502,
    "longitude": 36.752468,
    "connectors": [],
    "power_kw": 0,
    "guns": 1,
    "status": "unknown",
    "access": "",
    "price_note": "",
    "source_name": "Uploaded EV charger location dataset / Google Maps link",
    "source_url": "https://www.google.com/maps?q=35.059502,36.752468",
    "source_date": "",
    "last_verified": "",
    "data_quality": "Unverified",
    "notes": "Site type: Mall / Commercial. Status, connector type, charging power, source date, and last verification date were not provided in the uploaded dataset."
  },
  {
    "id": "SY-HA-HAM-AFAMIA-001",
    "name_ar": "Afamia Al-Sham Hotel",
    "name_en": "Afamia Al-Sham Hotel",
    "operator": "Electro taxi",
    "governorate": "Hama",
    "city": "Hama",
    "address": "Afamia Al-Sham Hotel",
    "latitude": 35.136437,
    "longitude": 36.754349,
    "connectors": [],
    "power_kw": 0,
    "guns": 1,
    "status": "unknown",
    "access": "",
    "price_note": "",
    "source_name": "Uploaded EV charger location dataset / Google Maps link",
    "source_url": "https://www.google.com/maps?q=35.136437,36.754349",
    "source_date": "",
    "last_verified": "",
    "data_quality": "Unverified",
    "notes": "Site type: Hotel. Status, connector type, charging power, source date, and last verification date were not provided in the uploaded dataset."
  },
  {
    "id": "SY-ID-IDL-GHAYDAQ-001",
    "name_ar": "Al-Ghaydaq Mall",
    "name_en": "Al-Ghaydaq Mall",
    "operator": "Electro taxi",
    "governorate": "Idlib",
    "city": "Idlib",
    "address": "Al-Ghaydaq Mall",
    "latitude": 36.104372,
    "longitude": 36.726167,
    "connectors": [],
    "power_kw": 0,
    "guns": 1,
    "status": "unknown",
    "access": "",
    "price_note": "",
    "source_name": "Uploaded EV charger location dataset / Google Maps link",
    "source_url": "https://www.google.com/maps?q=36.104372,36.726167",
    "source_date": "",
    "last_verified": "",
    "data_quality": "Unverified",
    "notes": "Site type: Mall / Commercial. Status, connector type, charging power, source date, and last verification date were not provided in the uploaded dataset."
  },
  {
    "id": "SY-LA-LAT-ORANGE-001",
    "name_ar": "Orange Mall",
    "name_en": "Orange Mall",
    "operator": "Electro taxi",
    "governorate": "Latakia",
    "city": "Latakia",
    "address": "Orange Mall",
    "latitude": 35.549221,
    "longitude": 35.761793,
    "connectors": [],
    "power_kw": 0,
    "guns": 1,
    "status": "unknown",
    "access": "",
    "price_note": "",
    "source_name": "Uploaded EV charger location dataset / Google Maps link",
    "source_url": "https://www.google.com/maps?q=35.549221,35.761793",
    "source_date": "",
    "last_verified": "",
    "data_quality": "Unverified",
    "notes": "Site type: Mall / Commercial. Status, connector type, charging power, source date, and last verification date were not provided in the uploaded dataset."
  },
  {
    "id": "SY-AL-ALE-CASTLE-001",
    "name_ar": "Citadel Complex Station (Formerly Al-Haydar)",
    "name_en": "Citadel Complex Station (Formerly Al-Haydar)",
    "operator": "Electro taxi",
    "governorate": "Aleppo",
    "city": "Aleppo",
    "address": "Citadel Complex Station (Formerly Al-Haydar)",
    "latitude": 36.192184,
    "longitude": 37.295601,
    "connectors": [],
    "power_kw": 0,
    "guns": 1,
    "status": "unknown",
    "access": "",
    "price_note": "",
    "source_name": "Uploaded EV charger location dataset / Google Maps link",
    "source_url": "https://www.google.com/maps?q=36.192184,37.295601",
    "source_date": "",
    "last_verified": "",
    "data_quality": "Unverified",
    "notes": "Site type: Service Station / Hub. Status, connector type, charging power, source date, and last verification date were not provided in the uploaded dataset."
  },
  {
    "id": "SY-DI-DAM-OFFICE-001",
    "name_ar": "SEVRA OFFICE",
    "name_en": "SEVRA OFFICE",
    "operator": "SEVRA",
    "governorate": "Damascus",
    "city": "Damascus",
    "address": "SEVRA OFFICE",
    "latitude": 33.512287,
    "longitude": 36.292997,
    "connectors": [],
    "power_kw": 0,
    "guns": 2,
    "status": "unknown",
    "access": "",
    "price_note": "",
    "source_name": "Uploaded EV charger location dataset / Google Maps link",
    "source_url": "https://maps.app.goo.gl/ZUN9XVita8uDuTB3A",
    "source_date": "",
    "last_verified": "",
    "data_quality": "Unverified",
    "notes": "Site type: Company / Office. Tooltip information not provided in uploaded dataset. Status, connector type, charging power, source date, and last verification date were not provided in the uploaded dataset."
  },
  {
    "id": "SY-DI-DAM-EMBASSY-001",
    "name_ar": "The Turkish Embassy",
    "name_en": "The Turkish Embassy",
    "operator": "SEVRA",
    "governorate": "Damascus",
    "city": "Damascus",
    "address": "The Turkish Embassy",
    "latitude": 33.52164,
    "longitude": 36.283646,
    "connectors": [],
    "power_kw": 0,
    "guns": 1,
    "status": "unknown",
    "access": "",
    "price_note": "",
    "source_name": "Uploaded EV charger location dataset / Google Maps link",
    "source_url": "https://maps.app.goo.gl/hjNzcuBy2DJh69QY8",
    "source_date": "",
    "last_verified": "",
    "data_quality": "Unverified",
    "notes": "Site type: Embassy / Government. Tooltip information not provided in uploaded dataset. Status, connector type, charging power, source date, and last verification date were not provided in the uploaded dataset."
  }
]
